{
  "kind": "cineweave_codex_scene_review",
  "contractVersion": "2.0.0",
  "worldId": "world-cloud-dynasty",
  "reviewId": "review.scene-shot-12",
  "sceneSpecRef": {
    "sceneId": "scene.jade-corridor",
    "version": 1,
    "contentHash": "sha256:dddddddddddddddddddddddddddddddddddddddddddddddddddddddddddddddd"
  },
  "sceneStateRef": {
    "sceneStateId": "scene-state.jade-corridor-storm",
    "version": 1,
    "contentHash": "sha256:eeeeeeeeeeeeeeeeeeeeeeeeeeeeeeeeeeeeeeeeeeeeeeeeeeeeeeeeeeeeeeee"
  },
  "bindingRef": "binding.scene-shot-12",
  "skillReceipt": {
    "repository": "https://github.com/owner/repository",
    "ref": "v2.0.0",
    "commit": "0123456789abcdef0123456789abcdef01234567",
    "contentHash": "sha256:aaaaaaaaaaaaaaaaaaaaaaaaaaaaaaaaaaaaaaaaaaaaaaaaaaaaaaaaaaaaaaaa",
    "installedBy": "codex-environment",
    "usedAt": "2026-08-20T12:00:00.000Z"
  },
  "candidateObservationIds": [
    "OBS_CANDIDATE_SCENE_12_A"
  ],
  "scope": "full",
  "criteria": [
    {
      "criterionId": "criterion.axis",
      "category": "camera_axis",
      "expected": "机位保持在主轴 B 侧",
      "observed": "候选保持 B 侧，人物屏幕方向连续",
      "status": "pass",
      "severity": "info",
      "evidenceObservationIds": [
        "OBS_CANDIDATE_SCENE_12_A"
      ]
    },
    {
      "criterionId": "criterion.screen",
      "category": "geography",
      "expected": "第三开间屏风位于西北侧",
      "observed": "屏风被移动到东南栏杆边，改变了遮挡路径",
      "status": "fail",
      "severity": "blocking",
      "evidenceObservationIds": [
        "OBS_CANDIDATE_SCENE_12_A"
      ]
    }
  ],
  "summary": {
    "overallStatus": "fail",
    "confidence": "high",
    "driftCategories": [
      "geography"
    ],
    "notes": "轴线正确，但关键遮挡锚点位置漂移。"
  },
  "decision": {
    "nextAction": "repair",
    "smallestRepairVariable": "spatialRelations.occlusion.screen.placement",
    "preserve": [
      "机位、人物、光向、材质和其他地理锚点"
    ],
    "stopCondition": "屏风恢复第三开间西北侧且不改变动作轴线。"
  },
  "validation": {
    "evidenceScoped": true,
    "noGenerationClaim": true,
    "parentImmutable": true
  }
}
